Japanese_Input,Japanese,Type,Image,Audio,Vietnamese,Korean,Chinese_Simplified,Chinese_Traditional,English,Spanish_LA,Spanish_SP,Word_1,Word_2,Word_3,Word_4,Word_Example_1,Word_Example_2,Word_Example_3,Word_Example_4,Word_Example_1_Audio,Word_Example_2_Audio,Word_Example_3_Audio,Word_Example_4_Audio
‎（のび太のパパ）えーと<br>‎あれはどこにしまったっけ？,‎（のび 太[た]のパパ）えーと<br>‎あれはどこにしまったっけ？,えーとあれはどこにしまったっけ,"<img src=""Doraemon_S01E816_Episode_21146.jpeg"">",[sound:Doraemon_S01E816_Episode_20996.mp3],(Bố Nobita) Ừm… Mình đã cất cái đó ở đâu nhỉ?,,,,(Nobita’s Dad) Umm… Where did I put that again?,,,しまう: 物[ぶつ]を 片付[かたづ]けること。,っけ: 思い出[おもいだ]し・ 確認[かくにん]の 終助詞[しゅうじょし]。,あれ: 遠[とお]くの 物[もの]を 指[さ]す。,,本[ほん]を 机[つくえ]の 引き出[ひきだ]しにしまった。,宿題[しゅくだい]をやったっけ？,あれは 私[わたし]の 本[ほん]です。,,[sound:hypertts-f5d86a5a09e8e9a928eeb4e8f6f0b5b96246539bf896c9d2152c9c19.mp3],[sound:hypertts-52a61c329e82fdf232e17204b237f54b91b84ec9efb29366fb49327e.mp3],[sound:hypertts-522ef360bc6c5117a8b1d661489ef2b53f4adfc5e7809b07f359527a.mp3],
‎（のび太のママ）何ですか！<br>‎こんなに散らかして！,‎（のび 太[た]のママ） 何[なに]ですか！<br>‎こんなに 散[ち]らかして！,何ですかこんなに散らかして,"<img src=""Doraemon_S01E816_Episode_44711.jpeg"">",[sound:Doraemon_S01E816_Episode_44561.mp3],(Mẹ Nobita) Cái gì thế này?! Sao bừa bộn thế này!,,,,(Nobita’s Mom) What is this?! How could you make such a mess!,,,散[ち]らかす: 物[ぶつ]を 乱雑[らんざつ]に 置[お]く。,こんなに: 程度[ていど]の 高[たか]さを 示[しめ]す。,何[なに]ですか: 驚[おどろ]きや 問[と]い。,,子供[こども]が 部屋[へや]を 散[ち]らかした。,こんなに 大[おお]きいとは 思[おも]わなかった。,これは 何[なに]ですか。,,[sound:hypertts-ff123795f6a2e47d0c98660bc745827bcc3ca0abace50e927966c812.mp3],[sound:hypertts-7380efec5d11c50121f778d7d84ded068e8effea82b3d6a98e40bbea.mp3],[sound:hypertts-ec6dc15e4f63c1e4b59b27ea5de2c210530e6b8ae4747e29ee4aa91b.mp3],
‎これくらいのほうが<br>‎僕は落ち着くんだよ,‎これくらいのほうが<br>‎ 僕[ぼく]は 落ち着[おちつ]くんだよ,これくらいのほうが僕は落ち着くんだよ,"<img src=""Doraemon_S01E816_Episode_52427.jpeg"">",[sound:Doraemon_S01E816_Episode_52277.mp3],Con thấy thoải mái hơn khi để thế này.,,,,I feel more comfortable like this.,,,落ち着[おちつ]く: 心[しん]が 安定[あんてい]する。,これくらい:この 程度[ていど]。,~んだよ: 説明[せつめい]・ 強調[きょうちょう]。,,コーヒーを 飲[の]むと 落ち着[おちつ]く。,これくらいの 距離[きょり]なら 歩[ある]ける。,彼[かれ]は 学生[がくせい]なんだよ。,,[sound:hypertts-385bad488b00bf053943ef3530b2f7ec35824f8e6bf0b1aa8e5bcb4b.mp3],[sound:hypertts-f154dc7fd7635684d4189107394a2da2ded77201fede121dc4a1ffe5.mp3],[sound:hypertts-f450a0ee701dd223f241477ec254db8d466b210782a141cb0c2842ce.mp3],
‎家じゅうを思い切って<br>‎整理することにしたから,‎ 家[いえ]じゅうを 思い切[おもいき]って<br>‎ 整理[せいり]することにしたから,家じゅうを思い切って整理することにしたから,"<img src=""Doraemon_S01E816_Episode_60060.jpeg"">",[sound:Doraemon_S01E816_Episode_59910.mp3],Mẹ đã quyết định mạnh dạn dọn dẹp cả nhà mình.,,,,I decided to boldly clean up the whole house.,,,思い切[おもいき]って:ためらわずに。,整理[せいり]する: 片付[かたづ]けて 整[ととの]える。,~ことにした: 決定[けってい]を 表[あらわ]す。,,思い切[おもいき]って 告白[こくはく]した。,机[つくえ]の 上[うえ]を 整理[せいり]する。,日本[にっぽん]へ 行[い]くことにした。,,[sound:hypertts-62656c19bc92f4e8bd342d14db9dd9b5a1bf14532e6e423adf5f8ec6.mp3],[sound:hypertts-98e812cd30eb8ad91aab8a6b8f748f559c14aab5a95abaa1ce894b87.mp3],[sound:hypertts-ab6a50e7c2ccba7fb381e8e3a0b975c06c3d7d27e82a615a7cc26715.mp3],
‎のび太も自分の部屋を<br>‎片づけなさい！,‎のび 太[た]も 自分[じぶん]の 部屋[へや]を<br>‎ 片[かた]づけなさい！,のび太も自分の部屋を片づけなさい,"<img src=""Doraemon_S01E816_Episode_63396.jpeg"">",[sound:Doraemon_S01E816_Episode_63246.mp3],"Nobita, con cũng phải dọn phòng của mình đi!",,,,"Nobita, you tidy up your room too!",,,片[かた]づける: 整理[せいり]する。,~なさい: 命令形[めいれいけい]の 丁寧[ていねい]。,自分[じぶん]: 自[みずか]ら。,,宿題[しゅくだい]を 片[かた]づけた。,早[はや]く 寝[ね]なさい。,自分[じぶん]の 意見[いけん]を 言[い]う。,,[sound:hypertts-2d8a4808f5f8af1923e5d0f476685150620e1ace15e2bbdceeb5f799.mp3],[sound:hypertts-6d890baa2254c216d28454bae3684aaa2618036e810b1bc017370ff7.mp3],[sound:hypertts-8b5258cbd4a6d3a555460a1407ffaa628f74849c29a6d15d89a2d5c6.mp3],
‎（ドラえもん）だから<br>‎片づけろって言ったのに,‎（ ドラ[どら]えもん）だから<br>‎ 片[かた]づけろって 言[い]ったのに,だから片づけろって言ったのに,"<img src=""Doraemon_S01E816_Episode_68401.jpeg"">",[sound:Doraemon_S01E816_Episode_68251.mp3],Vì thế tớ đã bảo cậu phải dọn dẹp rồi mà!,,,,That’s why I told you to clean up!,,,~ろ: 命令形[めいれいけい]。,~って: 引用[いんよう]の 口語[こうご] 表現[ひょうげん]。,のに: 不満[ふまん]・ 逆接[ぎゃくせつ]。,,宿題[しゅくだい]をやれ！と 言[い]った。,明日[あした] 行[い]くって 聞[き]いた。,こんなに 頑張[がんば]ったのに。,,[sound:hypertts-e390e91c071fba10fbc324bf4f3a46c822443fcbec648f1695a7706f.mp3],[sound:hypertts-aba2046d0c9e3eb3d411d0413ad01e01c27298e8937ff6019f4801db.mp3],[sound:hypertts-c2219ce08f05d18c01c57300f44bf1d82143b6055e624e9e0698f188.mp3],
‎（スネ夫(お)）だったら僕の部屋を<br>‎参考にしなよ,‎（スネ 夫[おっと](お)）だったら 僕[ぼく]の 部屋[へや]を<br>‎ 参考[さんこう]にしなよ,だったら僕の部屋を参考にしなよ,"<img src=""Doraemon_S01E816_Episode_87587.jpeg"">",[sound:Doraemon_S01E816_Episode_87437.mp3],Vậy thì lấy phòng của tớ làm tham khảo đi!,,,,"Then, use my room as a reference!",,,参考[さんこう]にする: 手本[てほん]にする。,~なよ: 軽[かる]い 命令[めいれい]。,だったら:もしそうなら。,,本[ほん]を 参考[さんこう]にして 書[か]いた。,早[はや]く 行[い]きなよ。,雨[あめ]だったら 中止[ちゅうし]する。,,[sound:hypertts-cebd6b2ac719c6c798287228d7d28905ff6dc34c991dbd4ffa6962ae.mp3],[sound:hypertts-08b3eebec998fa870aa6534bba2fdf02b2792c39ade8dfdd52e47417.mp3],[sound:hypertts-49c02e23fd93f698477db91c2babfc5aea3533013e2607d13686f2ae.mp3],
‎壁に収納できる物だけを残して<br>‎あとは全部捨てたんだ,‎ 壁[かべ]に 収納[しゅうのう]できる 物[もの]だけを 残[のこ]して<br>‎あとは 全部[ぜんぶ] 捨[す]てたんだ,壁に収納できる物だけを残してあとは全部捨てたんだ,"<img src=""Doraemon_S01E816_Episode_105855.jpeg"">",[sound:Doraemon_S01E816_Episode_105705.mp3],"Tớ chỉ giữ lại thứ treo tường được, còn lại vứt hết.",,,,I kept only what could be stored on the wall and threw the rest away.,,,収納[しゅうのう]: 物[ぶつ]をしまうこと。,捨[す]てる: 投[な]げて 処分[しょぶん]する。,残[のこ]す: 一部[いちぶ]を 取[と]っておく。,,洋服[ようふく]を 収納[しゅうのう]する。,ごみを 捨[す]てる。,メモを 残[のこ]す。,,[sound:hypertts-519d05cb743674e4ac823419110d8a1483148981a5d5d01057760272.mp3],[sound:hypertts-a95e7b62ddd7656152af8e098a5b2afb234b407f02e9751ce1547d11.mp3],[sound:hypertts-e4d09a449fcf4609f52c1f6e1106f941576fd7fc773843482ed46e4d.mp3],
‎今はなるべく<br>‎物をなくして暮らすのが<br>‎おしゃれなんだ,‎ 今[いま]はなるべく<br>‎ 物[ぶつ]をなくして 暮[く]らすのが<br>‎おしゃれなんだ,今はなるべく物をなくして暮らすのがおしゃれなんだ,"<img src=""Doraemon_S01E816_Episode_114823.jpeg"">",[sound:Doraemon_S01E816_Episode_114673.mp3],"Bây giờ, sống tối giản mới là hợp thời trang.",,,,"Nowadays, living with as few things as possible is stylish.",,,なるべく:できるだけ。,暮[く]らす: 生活[せいかつ]する。,おしゃれ: 流行[りゅうこう]に 合[あ]うこと。,,なるべく 早[はや]く 来[き]て。,都会[とかい]で 暮[く]らす。,おしゃれな 服[ふく]を 着[き]る。,,[sound:hypertts-6b08bfdc625347bd2e44696227a611bf4fd1be445d1c3611253a1f5f.mp3],[sound:hypertts-aac238db7eda4c9733dc6bdda952be785206cb880952f145b05ae5d0.mp3],[sound:hypertts-90836d906c90bf18099127e8f0b91be139a763bc00fe255e97b39f22.mp3],
‎パンツもシャツも枚数を決めて<br>‎１枚買ったら１枚捨てる,‎パンツもシャツも 枚数[まいすう]を 決[き]めて<br>‎１ 枚[まい] 買[か]ったら１ 枚[まい] 捨[す]てる,パンツもシャツも枚数を決めて１枚買ったら１枚捨てる,"<img src=""Doraemon_S01E816_Episode_119244.jpeg"">",[sound:Doraemon_S01E816_Episode_119094.mp3],"Quy định số lượng quần áo, mua 1 cái mới thì bỏ 1 cái cũ.",,,,"Decide the number of pants and shirts, and for every new one, throw one away.",,,枚数[まいすう]: 紙[し]や 服[ふく]の 数[かず]。,捨[す]てる: 物[ぶつ]を 処分[しょぶん]する。,決[き]める: 方針[ほうしん]を 決定[けってい]する。,,シャツの 枚数[まいすう]を 数[かぞ]える。,古新聞[ふるしんぶん]を 捨[す]てる。,日程[にってい]を 決[き]める。,,[sound:hypertts-dfe3413a3147a19553d2d2c20156c008b8dacfd43902f8da3124ce32.mp3],[sound:hypertts-ccd9b49cf2f07fdb37ff7c29ea9335d15cfff6cd6b9dde09cc341676.mp3],[sound:hypertts-2e51415847e101d04a9830e4ce07dd354bdb3f36090f37e710f4ff5e.mp3],
‎古いおもちゃも<br>‎キラめかなくなったら<br>‎スッパリ捨てる！,‎ 古[ふる]いおもちゃも<br>‎キラめかなくなったら<br>‎スッパリ 捨[す]てる！,古いおもちゃもキラめかなくなったらスッパリ捨てる,"<img src=""Doraemon_S01E816_Episode_124249.jpeg"">",[sound:Doraemon_S01E816_Episode_124099.mp3],Đồ chơi cũ cũng vậy — không còn lấp lánh mới mẻ thì bỏ ngay!,,,,"Old toys too — once they lose their shine, throw them away cleanly!",,,スッパリ:きれいに 断ち切[たちき]る。,捨[す]てる: 使[つか]わなくする。,~たら: 条件[じょうけん]。,,タバコをスッパリやめた。,古[ふる]い 靴[くつ]を 捨[す]てた。,雨[あめ]が 降[ふ]ったら 行[い]かない。,,[sound:hypertts-00569b0ec67cd7110645b47bb90c64eb46425aca16d5cc58eb8977fd.mp3],[sound:hypertts-3cd71d8adbde9ad12cd6519ded71bb47978b675676d4718c38624f88.mp3],[sound:hypertts-d8cd8a9bbe2275f8cdf7b497d95eeec710fc792aa06233536bebfc64.mp3],
‎今 海外じゃ常識だよ,‎ 今[いま] 海外[かいがい]じゃ 常識[じょうしき]だよ,今海外じゃ常識だよ,"<img src=""Doraemon_S01E816_Episode_127460.jpeg"">",[sound:Doraemon_S01E816_Episode_127310.mp3],"Ở nước ngoài bây giờ, đó là điều bình thường.",,,,"Abroad, that’s common sense now.",,,常識[じょうしき]: 一般[いっぱん]に 通[つう]じる 知識[ちしき]。,~じゃ:「では」の 口語[こうご]。,,,そんなことは 常識[じょうしき]だ。,ここじゃ 静[しず]かだ。,,,[sound:hypertts-35a53fd32a9fc26f8c5df460342503761a7333463111ae3d40d68655.mp3],[sound:hypertts-8c54f6cfdf323513443e2a7d74184b3ef1695f56e1d544fb6c41f4bf.mp3],,
‎うちには整理する場所もないからね,‎うちには 整理[せいり]する 場所[ばしょ]もないからね,うちには整理する場所もないからね,"<img src=""Doraemon_S01E816_Episode_135593.jpeg"">",[sound:Doraemon_S01E816_Episode_135443.mp3],Nhà mình thì chẳng có chỗ mà dọn dẹp cả.,,,,"In our house, there isn’t even space to organize.",,,整理[せいり]: 物[ぶつ]を 片付[かたづ]けること。,場所[ばしょ]:ところ。,からね: 理由[りゆう]を 柔[やわ]らかく 示[しめ]す。,,机[つくえ]の 中[なか]を 整理[せいり]する。,静[しず]かな 場所[ばしょ]で 勉強[べんきょう]する。,時間[じかん]がないからね。,,[sound:hypertts-4bf24bea005534f5d9ec5555819fbd86bbde5b1324f4fd61e7734d1b.mp3],[sound:hypertts-8fd7c54c4c275b22aefe484a3b8f6efe28cb8bc3cc3c31970d2f47f5.mp3],[sound:hypertts-bda626123555c7b1baa23b7c2e91aeebbf464b9d2e27b64c5465d91d.mp3],
‎ドラえもんが来る前は とりあえず<br>‎あそこに押し込めば済んだのに,‎ ドラ[どら]えもんが 来[く]る 前[まえ]はとりあえず<br>‎あそこに 押し込[おしこ]めば 済[す]んだのに,ドラえもんが来る前はとりあえずあそこに押し込めば済んだのに,"<img src=""Doraemon_S01E816_Episode_138555.jpeg"">",[sound:Doraemon_S01E816_Episode_138405.mp3],"Trước khi Doraemon đến, chỉ cần nhét tạm vào đó là xong.",,,,"Before Doraemon came, I could just shove things in there and be done.",,,押し込[おしこ]む: 無理[むり]に 入[い]れる。,済[す]む: 終[お]わる・ 解決[かいけつ]する。,のに: 不満[ふまん]・ 逆接[ぎゃくせつ]。,,荷物[にもつ]を 押し込[おしこ]む。,これで 済[す]む 問題[もんだい]だ。,行[い]ったのに 会[あ]えなかった。,,[sound:hypertts-7bb16384e61988de2daaa959df955f9c5a5381760b83d2e4f9ad4f8e.mp3],[sound:hypertts-8b9cedb25006112d5a9312ccbedcd0d2009d36a91fbb1d87aecfad78.mp3],[sound:hypertts-21200eadde5d8d0049cec6b3204444b6c5fb9b3eca6f7610d1abaa99.mp3],
‎冗談じゃない！<br>‎僕のせいにされてたまるか！,‎ 冗談[じょうだん]じゃない！<br>‎ 僕[ぼく]のせいにされてたまるか！,冗談じゃない僕のせいにされてたまるか,"<img src=""Doraemon_S01E816_Episode_143101.jpeg"">",[sound:Doraemon_S01E816_Episode_142951.mp3],Đừng có đùa! Đừng có đổ lỗi cho tớ!,,,,You’ve got to be kidding! Don’t blame it on me!,,,冗談[じょうだん]じゃない: 強[つよ]い 否定[ひてい]。,せいにする: 責任[せきにん]を 押し付[おしつ]ける。,~てたまるか: 強[つよ]い 拒否[きょひ]。,,冗談[じょうだん]じゃないよ！,失敗[しっぱい]を 人[ひと]のせいにするな。,行[い]くもんか！(＝てたまるか),,[sound:hypertts-4d2566a5aad0002c4d3429195e682b18f592146968c62b8213ee4e18.mp3],[sound:hypertts-069a09d7b5d42424e72861c8188327e7fab2a2636dc0951e19f3f2c3.mp3],[sound:hypertts-439ac13cef4359917654d3da648fa4ff4de57675ac8c81382316c414.mp3],
‎よし こうなったら<br>‎絶対 物を捨てさせてやる！,‎よしこうなったら<br>‎ 絶対[ぜったい] 物[ぶつ]を 捨[す]てさせてやる！,よしこうなったら絶対物を捨てさせてやる,"<img src=""Doraemon_S01E816_Episode_153027.jpeg"">",[sound:Doraemon_S01E816_Episode_152877.mp3],"Được, nếu thế thì tớ sẽ bắt cậu phải vứt đồ đi!",,,,"Fine, if it comes to this, I’ll make him throw things away!",,,~こうなったら: 状況[じょうきょう]を 受[う]けて 決意[けつい]。,~させる: 使役[しえき]。,捨[す]てる: 物[ぶつ]を 処分[しょぶん]する。,,こうなったら 全力[ぜんりょく]でやる。,子供[こども]に 掃除[そうじ]をさせる。,古[ふる]い 服[ふく]を 捨[す]てる。,,[sound:hypertts-e438518ec0b4ed0d9172ac093e705b9761631cbd8cb7808b565b3022.mp3],[sound:hypertts-6fa962256e41555f6f12961548b18ae7a45af3f9948c1d406c5175c3.mp3],[sound:hypertts-79a589a04c8e5577abccd87d3aa53367674a4c10969e5202385007e4.mp3],
‎この道具は<br>‎持っている物を全部整理して<br>‎並べて見せてくれるだけなんだ,‎この 道具[どうぐ]は<br>‎ 持[も]っている 物[もの]を 全部[ぜんぶ] 整理[せいり]して<br>‎ 並[な]べて 見[み]せてくれるだけなんだ,この道具は持っている物を全部整理して並べて見せてくれるだけなんだ,"<img src=""Doraemon_S01E816_Episode_165665.jpeg"">",[sound:Doraemon_S01E816_Episode_165515.mp3],Dụng cụ này chỉ sắp xếp và cho xem những gì cậu có thôi.,,,,This tool only organizes and displays what you own.,,,並[なら]べる: 順[じゅん]に 置[お]く。,見[み]せる: 示[しめ]す。,~だけなんだ: 限定[げんてい] 表現[ひょうげん]。,,本[ほん]を 順番[じゅんばん]に 並[なら]べる。,写真[しゃしん]を 見[み]せる。,趣味[しゅみ]なだけなんだ。,,[sound:hypertts-f6fdc4e841af6b4360090fb6aebce158ababdef218ff442d5d6a0eaa.mp3],[sound:hypertts-4dc4aafc0dbe2ad97c645c690a2ef0ed21775cc8a331531b94cfe2ac.mp3],[sound:hypertts-60ae232b956a7a2fa6832c25b29ec1f28339a203e17e413496f42d81.mp3],
‎のび太君の部屋にある物を<br>‎細かく分類して<br>‎分かりやすく並べてあるんだ,‎のび 太[た] 君[くん]の 部屋[へや]にある 物[もの]を<br>‎ 細[こま]かく 分類[ぶんるい]して<br>‎ 分[わ]かりやすく 並[な]べてあるんだ,のび太君の部屋にある物を細かく分類して分かりやすく並べてあるんだ,"<img src=""Doraemon_S01E816_Episode_192442.jpeg"">",[sound:Doraemon_S01E816_Episode_192292.mp3],Đồ đạc trong phòng Nobita được phân loại kỹ và bày biện rõ ràng.,,,,The things in Nobita’s room are classified in detail and neatly displayed.,,,分類[ぶんるい]する: 種類[しゅるい]に 分[わ]ける。,細[こま]かく: 詳[くわ]しく。,分[わ]かりやすく: 理解[りかい]しやすく。,,本[ほん]をジャンルで 分類[ぶんるい]する。,細[こま]かく 説明[せつめい]する。,図[ず]で 分[わ]かりやすく 示[しめ]す。,,[sound:hypertts-b9322d0eb5539d2d56f68439651ff69363fba057a7707b64b3a779c5.mp3],[sound:hypertts-0785a10df6480e626fee0dd49daa60adce218e931656a08d91cc349e.mp3],[sound:hypertts-28f1160d618fc17126c282c52210c34a550d9fb54dc3f6fc3d3e59cc.mp3],
‎何をどれだけ持っているか<br>‎ひと目で分かるから<br>‎いらない物もすぐ分かる,‎ 何[なに]をどれだけ 持[も]っているか<br>‎ひと 目[め]で 分[わ]かるから<br>‎いらない 物[もの]もすぐ 分[わ]かる,何をどれだけ持っているかひと目で分かるからいらない物もすぐ分かる,"<img src=""Doraemon_S01E816_Episode_197906.jpeg"">",[sound:Doraemon_S01E816_Episode_197756.mp3],"Chỉ cần nhìn qua là biết có gì, thừa cái gì.",,,,You can see at a glance what you own and easily spot what’s unnecessary.,,,ひと 目[め]で: 一瞬[いっしゅん]で。,~だけ: 数量[すうりょう]や 範囲[はんい]。,いらない 物[もの]: 不要[ふよう]な 物[もの]。,,ひと 目[め]で 気に入[きにい]った。,水[みず]だけ 飲[の]む。,いらない 物[もの]を 捨[す]てる。,,[sound:hypertts-89f2220c549556486563e39e4e9a94f0a169acacebdd139a0b99082c.mp3],[sound:hypertts-53e7850fd017b01f38156f4fff8aaa5cd613aaf8bacec6ca7b3f3b68.mp3],[sound:hypertts-13cb7ea1b1e5c2f3d30eb5f3261230a050698b4a410ab23fcbfa05f3.mp3],
‎勉強道具のコーナーだよ,‎ 勉強[べんきょう] 道具[どうぐ]のコーナーだよ,勉強道具のコーナーだよ,"<img src=""Doraemon_S01E816_Episode_223765.jpeg"">",[sound:Doraemon_S01E816_Episode_223615.mp3],Đây là góc để đồ học tập.,,,,This is the study tools corner.,,,道具[どうぐ]: 使[つか]う 物[もの]。,コーナー: 一角[いっかく]、 区画[くかく]。,,,キャンプの 道具[どうぐ]を 持[も]っていく。,本[ほん]のコーナーを 探[さが]す。,,,[sound:hypertts-c80d93529e693d0f85a79011c1c90ab8b15c9e500d82f0bbfed5c975.mp3],[sound:hypertts-a1c402ce9753e41b4e4a4551aac234d595fa29abbfc6cc5aa4b978b4.mp3],,
‎片方だけの靴下がこんなにあるよ<br>‎互い違いで<br>‎はきたい日があるかも！,‎ 片方[かたほう]だけの 靴下[くつした]がこんなにあるよ<br>‎ 互い違[たがいちが]いで<br>‎はきたい 日[ひ]があるかも！,片方だけの靴下がこんなにあるよ互い違いではきたい日があるかも,"<img src=""Doraemon_S01E816_Episode_255213.jpeg"">",[sound:Doraemon_S01E816_Episode_255063.mp3],Có nhiều chiếc vớ lẻ thế này—biết đâu có ngày muốn mang lệch!,,,,There are so many single socks—maybe I’ll want to wear mismatched ones someday!,,,片方[かたほう]:ペアの 一[ひと]つ。,互い違[たがいちが]い: 交互[こうご]に 異[こと]なる。,~かも: 推量[すいりょう]。,,片方[かたほう]の 靴[くつ]をなくした。,赤[あか]と 青[あお]を 互い違[たがいちが]いに 並[なら]べる。,明日[あした] 雨[あめ]かもしれない。,,[sound:hypertts-e9566a9a4b84e8824be4584c34fa379e3ccd0092452e75042c1790cf.mp3],[sound:hypertts-85a159fd9f4222b6d24eb9afd815ad22f6a46cb8ae94f3e53f3cce52.mp3],[sound:hypertts-993ddcaadc8bf93d396807d91fcff6ab5fa1eb091e4dbc6b1293a6f2.mp3],
‎読まないマンガは<br>‎捨てていいんじゃないの？<br>‎捨てるなんて これは財産だよ！,‎ 読[よ]まないマンガは<br>‎ 捨[す]てていいんじゃないの？<br>‎ 捨[す]てるなんてこれは 財産[ざいさん]だよ！,読まないマンガは捨てていいんじゃないの捨てるなんてこれは財産だよ,"<img src=""Doraemon_S01E816_Episode_271521.jpeg"">",[sound:Doraemon_S01E816_Episode_271371.mp3],Truyện tranh không đọc thì bỏ đi? Không được—đây là tài sản quý giá!,,,,"If you don’t read the manga, why not throw it away? No way—this is treasure!",,,財産[ざいさん]: 大切[たいせつ]な 物[もの]。,~んじゃない: 軽[かる]い 提案[ていあん]。,~なんて: 驚[おどろ]き・ 軽視[けいし]。,,家[いえ]は 大[おお]きな 財産[ざいさん]だ。,少[すこ]し 休[やす]んだらいいんじゃない？,嘘[うそ]なんて 信[しん]じない。,,[sound:hypertts-ec7146aba437f095322e2a2a34de41a38ab4a46df302c3e89af6bd86.mp3],[sound:hypertts-377b1d61fe29c1f0e7bb5a029f1d84634c42b0e2cbc1d3b717357e4b.mp3],[sound:hypertts-96b7fe7a129de314174038ff0381dba15f3fa9a17638a0430fdd7597.mp3],
‎（ジャイアン）そんな昔のこと<br>‎覚えてねえよ！,‎（ジャイアン）そんな 昔[むかし]のこと<br>‎ 覚[おぼ]えてねえよ！,そんな昔のこと覚えてねえよ,"<img src=""Doraemon_S01E816_Episode_288204.jpeg"">",[sound:Doraemon_S01E816_Episode_288054.mp3],"Chuyện xưa thế rồi, tớ làm sao nhớ!",,,,"That’s so long ago, I don’t remember!",,,覚[おぼ]える: 記憶[きおく]する。,~ねえ:~ないの 俗語[ぞくご]。,昔[むかし]: 過去[かこ]のこと。,,歌詞[かし]を 覚[おぼ]える。,金[きん]なんてねえよ。,昔[むかし]の 友達[ともだち]に 会[あ]った。,,[sound:hypertts-d83a287c119592aefa2306e8d689cf2b6c7d256cfebbef5dec0c63fe.mp3],[sound:hypertts-08854691aed2590e6ecac7f2ad27142d63adce9ad9314e47c2d85e34.mp3],[sound:hypertts-0e21c58110a0e1e32d0cad0188debe06f956ebac0a4c9575353c3b1e.mp3],
‎借りた物ばっかり<br>‎いつか返すんだから文句ないだろ,‎ 借[か]りた 物[もの]ばっかり<br>‎いつか 返[かえ]すんだから 文句[もんく]ないだろ,借りた物ばっかりいつか返すんだから文句ないだろ,"<img src=""Doraemon_S01E816_Episode_303678.jpeg"">",[sound:Doraemon_S01E816_Episode_303266.mp3],"Toàn là đồ mượn thôi—sẽ trả lại mà, đừng than phiền!",,,,"They’re all borrowed things—I’ll return them someday, so no complaints!",,,借[か]りる: 他人[たにん]の 物[もの]を 使[つか]う。,文句[もんく]: 不満[ふまん]。,いつか: 将来[しょうらい]のある 時[とき]。,,本[ほん]を 友達[ともだち]から 借[か]りた。,文句[もんく]ばかり 言[い]うな。,いつか 旅行[りょこう]したい。,,[sound:hypertts-22da1fcdee746972b7e90e546fb516fb1a8f826d57dcb17bb26f8f3b.mp3],[sound:hypertts-af81ada6b1a0d09ae084a70fc7bade14ab7d61b601cac297421084af.mp3],[sound:hypertts-ac4a8867c1e1971058ec9f08f84a3bf25a95de77d88b579bed6f5199.mp3],
